### ISSUE TITLE
Can't retrieve video stream

### ISSUE THREAD

**Issue by Yaty** [benjojo/de-ip-hdmi#14]
Hello,

Thanks for this tool !
I use a V2 sender and I'm trying to get the video stream in VLC.

```
hugo@hdrpc:~$ sudo de-ip-hdmi -interface enp3s0 -sender-mac 000b78006001 -audio false | vlc -
VLC media player 3.0.4 Vetinari (revision 3.0.4-0-gf615db6332)
[000055df75113570] main libvlc: Lancement de vlc avec l'interface par défaut. Utilisez « cvlc » pour démarrer VLC sans interface.
Warning: QT_DEVICE_PIXEL_RATIO is deprecated. Instead use:
   QT_AUTO_SCREEN_SCALE_FACTOR to enable platform plugin controlled per-screen factors.
   QT_SCREEN_SCALE_FACTORS to set per-screen factors.
   QT_SCALE_FACTOR to set the application global scale factor.
ffmpeg version 3.4.6-0ubuntu0.18.04.1 Copyright (c) 2000-2019 the FFmpeg developers
  built with gcc 7 (Ubuntu 7.3.0-16ubuntu3)
  configuration: --prefix=/usr --extra-version=0ubuntu0.18.04.1 --toolchain=hardened --libdir=/usr/lib/x86_64-linux-gnu --incdir=/usr/include/x86_64-linux-gnu --enable-gpl --disable-stripping --enable-avresample --enable-avisynth --enable-gnutls --enable-ladspa --enable-libass --enable-libbluray --enable-libbs2b --enable-libcaca --enable-libcdio --enable-libflite --enable-libfontconfig --enable-libfreetype --enable-libfribidi --enable-libgme --enable-libgsm --enable-libmp3lame --enable-libmysofa --enable-libopenjpeg --enable-libopenmpt --enable-libopus --enable-libpulse --enable-librubberband --enable-librsvg --enable-libshine --enable-libsnappy --enable-libsoxr --enable-libspeex --enable-libssh --enable-libtheora --enable-libtwolame --enable-libvorbis --enable-libvpx --enable-libwavpack --enable-libwebp --enable-libx265 --enable-libxml2 --enable-libxvid --enable-libzmq --enable-libzvbi --enable-omx --enable-openal --enable-opengl --enable-sdl2 --enable-libdc1394 --enable-libdrm --enable-libiec61883 --enable-chromaprint --enable-frei0r --enable-libopencv --enable-libx264 --enable-shared
  WARNING: library configuration mismatch
  avcodec     configuration: --prefix=/usr --extra-version=0ubuntu0.18.04.1 --toolchain=hardened --libdir=/usr/lib/x86_64-linux-gnu --incdir=/usr/include/x86_64-linux-gnu --enable-gpl --disable-stripping --enable-avresample --enable-avisynth --enable-gnutls --enable-ladspa --enable-libass --enable-libbluray --enable-libbs2b --enable-libcaca --enable-libcdio --enable-libflite --enable-libfontconfig --enable-libfreetype --enable-libfribidi --enable-libgme --enable-libgsm --enable-libmp3lame --enable-libmysofa --enable-libopenjpeg --enable-libopenmpt --enable-libopus --enable-libpulse --enable-librubberband --enable-librsvg --enable-libshine --enable-libsnappy --enable-libsoxr --enable-libspeex --enable-libssh --enable-libtheora --enable-libtwolame --enable-libvorbis --enable-libvpx --enable-libwavpack --enable-libwebp --enable-libx265 --enable-libxml2 --enable-libxvid --enable-libzmq --enable-libzvbi --enable-omx --enable-openal --enable-opengl --enable-sdl2 --enable-libdc1394 --enable-libdrm --enable-libiec61883 --enable-chromaprint --enable-frei0r --enable-libopencv --enable-libx264 --enable-shared --enable-version3 --disable-doc --disable-programs --enable-libopencore_amrnb --enable-libopencore_amrwb --enable-libtesseract --enable-libvo_amrwbenc
  libavutil      55. 78.100 / 55. 78.100
  libavcodec     57.107.100 / 57.107.100
  libavformat    57. 83.100 / 57. 83.100
  libavdevice    57. 10.100 / 57. 10.100
  libavfilter     6.107.100 /  6.107.100
  libavresample   3.  7.  0 /  3.  7.  0
  libswscale      4.  8.100 /  4.  8.100
  libswresample   2.  9.100 /  2.  9.100
  libpostproc    54.  7.100 / 54.  7.100
Input #0, mjpeg, from '/tmp/hdmi-Vfifo-kyfw9':
  Duration: N/A, bitrate: N/A
    Stream #0:0: Video: mjpeg, yuvj422p(pc, bt470bg/unknown/unknown), 1920x1080 [SAR 1:1 DAR 16:9], 25 tbr, 1200k tbn, 25 tbc
^CGuessed Channel Layout for Input Stream #1.0 : stereo
Input #1, s32be, from 'pipe:0':
  Duration: N/A, bitrate: 2822 kb/s
    Stream #1:0: Audio: pcm_s32be, 44100 Hz, stereo, s32, 2822 kb/s
Output #0, matroska, to 'pipe:1':
  Metadata:
    encoder         : Lavf57.83.100
    Stream #0:0: Video: mjpeg (MJPG / 0x47504A4D), yuvj422p(pc, bt470bg/unknown/unknown), 1920x1080 [SAR 1:1 DAR 16:9], q=2-31, 25 tbr, 1k tbn, 1200k tbc
    Stream #0:1: Audio: pcm_s32be ([255][255][255][255] / 0xFFFFFFFF), 44100 Hz, stereo, s32, 2822 kb/s
Stream mapping:
  Stream #0:0 -> #0:0 (copy)
  Stream #1:0 -> #0:1 (copy)
[00007f25f8017d90] mjpeg demux error: cannot peek
QObject::~QObject: Timers cannot be stopped from another thread
```

VLC seems to load forever (before I Ctrl + C).

I checked `tcpdump` and as expected I have a lot of traffic going on :

```
13:10:01.211062 IP 192.168.168.55.2065 > 226.2.2.2.2066: UDP, length 1008
13:10:01.211193 IP 192.168.168.55.2068 > 226.2.2.2.2068: UDP, length 1024
13:10:01.211834 IP 192.168.168.55.2068 > 226.2.2.2.2068: UDP, length 1024
...
```

I tried to pipe to ffplay instead of vlc and this what I get : 
```
hugo@hdrpc:~$ sudo de-ip-hdmi -interface enp3s0 -sender-mac 000b78006001 -audio false -raw | ffplay -
ffplay version 3.4.6-0ubuntu0.18.04.1 Copyright (c) 2003-2019 the FFmpeg developers
  built with gcc 7 (Ubuntu 7.3.0-16ubuntu3)
  configuration: --prefix=/usr --extra-version=0ubuntu0.18.04.1 --toolchain=hardened --libdir=/usr/lib/x86_64-linux-gnu --incdir=/usr/include/x86_64-linux-gnu --enable-gpl --disable-stripping --enable-avresample --enable-avisynth --enable-gnutls --enable-ladspa --enable-libass --enable-libbluray --enable-libbs2b --enable-libcaca --enable-libcdio --enable-libflite --enable-libfontconfig --enable-libfreetype --enable-libfribidi --enable-libgme --enable-libgsm --enable-libmp3lame --enable-libmysofa --enable-libopenjpeg --enable-libopenmpt --enable-libopus --enable-libpulse --enable-librubberband --enable-librsvg --enable-libshine --enable-libsnappy --enable-libsoxr --enable-libspeex --enable-libssh --enable-libtheora --enable-libtwolame --enable-libvorbis --enable-libvpx --enable-libwavpack --enable-libwebp --enable-libx265 --enable-libxml2 --enable-libxvid --enable-libzmq --enable-libzvbi --enable-omx --enable-openal --enable-opengl --enable-sdl2 --enable-libdc1394 --enable-libdrm --enable-libiec61883 --enable-chromaprint --enable-frei0r --enable-libopencv --enable-libx264 --enable-shared
  WARNING: library configuration mismatch
  avcodec     configuration: --prefix=/usr --extra-version=0ubuntu0.18.04.1 --toolchain=hardened --libdir=/usr/lib/x86_64-linux-gnu --incdir=/usr/include/x86_64-linux-gnu --enable-gpl --disable-stripping --enable-avresample --enable-avisynth --enable-gnutls --enable-ladspa --enable-libass --enable-libbluray --enable-libbs2b --enable-libcaca --enable-libcdio --enable-libflite --enable-libfontconfig --enable-libfreetype --enable-libfribidi --enable-libgme --enable-libgsm --enable-libmp3lame --enable-libmysofa --enable-libopenjpeg --enable-libopenmpt --enable-libopus --enable-libpulse --enable-librubberband --enable-librsvg --enable-libshine --enable-libsnappy --enable-libsoxr --enable-libspeex --enable-libssh --enable-libtheora --enable-libtwolame --enable-libvorbis --enable-libvpx --enable-libwavpack --enable-libwebp --enable-libx265 --enable-libxml2 --enable-libxvid --enable-libzmq --enable-libzvbi --enable-omx --enable-openal --enable-opengl --enable-sdl2 --enable-libdc1394 --enable-libdrm --enable-libiec61883 --enable-chromaprint --enable-frei0r --enable-libopencv --enable-libx264 --enable-shared --enable-version3 --disable-doc --disable-programs --enable-libopencore_amrnb --enable-libopencore_amrwb --enable-libtesseract --enable-libvo_amrwbenc
  libavutil      55. 78.100 / 55. 78.100
  libavcodec     57.107.100 / 57.107.100
  libavformat    57. 83.100 / 57. 83.100
  libavdevice    57. 10.100 / 57. 10.100
  libavfilter     6.107.100 /  6.107.100
  libavresample   3.  7.  0 /  3.  7.  0
  libswscale      4.  8.100 /  4.  8.100
  libswresample   2.  9.100 /  2.  9.100
  libpostproc    54.  7.100 / 54.  7.100
ffmpeg version 3.4.6-0ubuntu0.18.04.1 Copyright (c) 2000-2019 the FFmpeg developers
  built with gcc 7 (Ubuntu 7.3.0-16ubuntu3)
  configuration: --prefix=/usr --extra-version=0ubuntu0.18.04.1 --toolchain=hardened --libdir=/usr/lib/x86_64-linux-gnu --incdir=/usr/include/x86_64-linux-gnu --enable-gpl --disable-stripping --enable-avresample --enable-avisynth --enable-gnutls --enable-ladspa --enable-libass --enable-libbluray --enable-libbs2b --enable-libcaca --enable-libcdio --enable-libflite --enable-libfontconfig --enable-libfreetype --enable-libfribidi --enable-libgme --enable-libgsm --enable-libmp3lame --enable-libmysofa --enable-libopenjpeg --enable-libopenmpt --enable-libopus --enable-libpulse --enable-librubberband --enable-librsvg --enable-libshine --enable-libsnappy --enable-libsoxr --enable-libspeex --enable-libssh --enable-libtheora --enable-libtwolame --enable-libvorbis --enable-libvpx --enable-libwavpack --enable-libwebp --enable-libx265 --enable-libxml2 --enable-libxvid --enable-libzmq --enable-libzvbi --enable-omx --enable-openal --enable-opengl --enable-sdl2 --enable-libdc1394 --enable-libdrm --enable-libiec61883 --enable-chromaprint --enable-frei0r --enable-libopencv --enable-libx264 --enable-shared
  WARNING: library configuration mismatch
  avcodec     configuration: --prefix=/usr --extra-version=0ubuntu0.18.04.1 --toolchain=hardened --libdir=/usr/lib/x86_64-linux-gnu --incdir=/usr/include/x86_64-linux-gnu --enable-gpl --disable-stripping --enable-avresample --enable-avisynth --enable-gnutls --enable-ladspa --enable-libass --enable-libbluray --enable-libbs2b --enable-libcaca --enable-libcdio --enable-libflite --enable-libfontconfig --enable-libfreetype --enable-libfribidi --enable-libgme --enable-libgsm --enable-libmp3lame --enable-libmysofa --enable-libopenjpeg --enable-libopenmpt --enable-libopus --enable-libpulse --enable-librubberband --enable-librsvg --enable-libshine --enable-libsnappy --enable-libsoxr --enable-libspeex --enable-libssh --enable-libtheora --enable-libtwolame --enable-libvorbis --enable-libvpx --enable-libwavpack --enable-libwebp --enable-libx265 --enable-libxml2 --enable-libxvid --enable-libzmq --enable-libzvbi --enable-omx --enable-openal --enable-opengl --enable-sdl2 --enable-libdc1394 --enable-libdrm --enable-libiec61883 --enable-chromaprint --enable-frei0r --enable-libopencv --enable-libx264 --enable-shared --enable-version3 --disable-doc --disable-programs --enable-libopencore_amrnb --enable-libopencore_amrwb --enable-libtesseract --enable-libvo_amrwbenc
  libavutil      55. 78.100 / 55. 78.100
  libavcodec     57.107.100 / 57.107.100
  libavformat    57. 83.100 / 57. 83.100
  libavdevice    57. 10.100 / 57. 10.100
  libavfilter     6.107.100 /  6.107.100
  libavresample   3.  7.  0 /  3.  7.  0
  libswscale      4.  8.100 /  4.  8.100
  libswresample   2.  9.100 /  2.  9.100
  libpostproc    54.  7.100 / 54.  7.100
[mjpeg @ 0x55d987222160] Found EOI before any SOF, ignoring f=0/0   
Input #0, mjpeg, from '/tmp/hdmi-Vfifo-G33og':
  Duration: N/A, bitrate: N/A
    Stream #0:0: Video: mjpeg, yuvj422p(pc, bt470bg/unknown/unknown), 1920x1080 [SAR 1:1 DAR 16:9], 25 tbr, 1200k tbn, 25 tbc
^CGuessed Channel Layout for Input Stream #1.0 : stereo  0B f=0/0   
Input #1, s32be, from 'pipe:0':
  Duration: N/A, bitrate: 2822 kb/s
    Stream #1:0: Audio: pcm_s32be, 44100 Hz, stereo, s32, 2822 kb/s
Output #0, matroska, to 'pipe:1':
  Metadata:
    encoder         : Lavf57.83.100
    Stream #0:0: Video: mjpeg (MJPG / 0x47504A4D), yuvj422p(pc, bt470bg/unknown/unknown), 1920x1080 [SAR 1:1 DAR 16:9], q=2-31, 25 tbr, 1k tbn, 1200k tbc
    Stream #0:1: Audio: pcm_s32be ([255][255][255][255] / 0xFFFFFFFF), 44100 Hz, stereo, s32, 2822 kb/s
Stream mapping:
  Stream #0:0 -> #0:0 (copy)
  Stream #1:0 -> #0:1 (copy)
```

The MAC adress I use is the one given inside `http://192.168.168.55/`

Do you know what could be wrong here ?

Hugo

**Comment by benjojo** [comment]
It looks like the last ffplay has actually got a stream there!

Have you tried directly connecting the device to the ethernet port?

**Comment by Yaty** [comment]
It's already on the ethernet port ([enp3s0](https://www.freedesktop.org/software/systemd/man/systemd.net-naming-scheme.html))

**Comment by mattcampbellsa** [comment]
Hi there Benjojo,
Sorry to hijack / Negro this.

Firstly thank you for your efforts, I also followed Danman's guide and got as far as getting a picture piped through to VLC but no audio.

I'm still struggling to get that working, and googling some more I came across your project, I have tried using the precompile project and I am sitting with the same scenario as Yaty above, output it pretty much identical, but VLC doesn't display the output or the audio.

Any ideas?
Thanks
Matt

**Comment by benjojo** [comment]
Are you sure there is Audio on the HDMI link? If you could take a short (1s) pcap that might help

**Comment by mattcampbellsa** [comment]
wow thank you for the speedy response
I had followed Danmans guide which included steps for the audio,
it just sounds like static when importing RAW into audacity

I can send you a pcap if you would like to see for yourself?

**Comment by mattcampbellsa** [comment]
but a quick way to determine it for sure is that I have the corresponding receiver unit and it works as expected video and audio

**Comment by benjojo** [comment]
Yeah testing with a receiver works too if you have one, if not if you ZIP up 1s worth of traffic in a pcap here I might be able to see if there is audio data in line or not.

**Comment by mattcampbellsa** [comment]
[temp.pcap.zip](https://github.com/benjojo/de-ip-hdmi/files/4298300/temp.pcap.zip)

**Comment by benjojo** [comment]
There is audio data in there (port 2066 is the audio data), So at least theoretically it should work. What command options are you using?

**Comment by mattcampbellsa** [comment]
sudo /usr/bin/de-ip-hdmi -interface enp3s0f2 | vlc -

matt@matt-ubuntu:~/Downloads/de-ip-hdmi-master$ sudo /usr/bin/de-ip-hdmi -interface enp3s0f2 | vlc -
VLC media player 3.0.8 Vetinari (revision 3.0.8-0-gf350b6b5a7)
[0000561b7e55e570] main libvlc: Running vlc with the default interface. Use 'cvlc' to use vlc without interface.
ffmpeg version 3.4.6-0ubuntu0.18.04.1 Copyright (c) 2000-2019 the FFmpeg developers
  built with gcc 7 (Ubuntu 7.3.0-16ubuntu3)
  configuration: --prefix=/usr --extra-version=0ubuntu0.18.04.1 --toolchain=hardened --libdir=/usr/lib/x86_64-linux-gnu --incdir=/usr/include/x86_64-linux-gnu --enable-gpl --disable-stripping --enable-avresample --enable-avisynth --enable-gnutls --enable-ladspa --enable-libass --enable-libbluray --enable-libbs2b --enable-libcaca --enable-libcdio --enable-libflite --enable-libfontconfig --enable-libfreetype --enable-libfribidi --enable-libgme --enable-libgsm --enable-libmp3lame --enable-libmysofa --enable-libopenjpeg --enable-libopenmpt --enable-libopus --enable-libpulse --enable-librubberband --enable-librsvg --enable-libshine --enable-libsnappy --enable-libsoxr --enable-libspeex --enable-libssh --enable-libtheora --enable-libtwolame --enable-libvorbis --enable-libvpx --enable-libwavpack --enable-libwebp --enable-libx265 --enable-libxml2 --enable-libxvid --enable-libzmq --enable-libzvbi --enable-omx --enable-openal --enable-opengl --enable-sdl2 --enable-libdc1394 --enable-libdrm --enable-libiec61883 --enable-chromaprint --enable-frei0r --enable-libopencv --enable-libx264 --enable-shared
  libavutil      55. 78.100 / 55. 78.100
  libavcodec     57.107.100 / 57.107.100
  libavformat    57. 83.100 / 57. 83.100
  libavdevice    57. 10.100 / 57. 10.100
  libavfilter     6.107.100 /  6.107.100
  libavresample   3.  7.  0 /  3.  7.  0
  libswscale      4.  8.100 /  4.  8.100
  libswresample   2.  9.100 /  2.  9.100
  libpostproc    54.  7.100 / 54.  7.100
Input #0, mjpeg, from '/tmp/hdmi-Vfifo-IW7fU':
  Duration: N/A, bitrate: N/A
    Stream #0:0: Video: mjpeg, yuvj422p(pc, bt470bg/unknown/unknown), 1280x540 [SAR 1:1 DAR 64:27], 25 tbr, 1200k tbn, 25 tbc
^CGuessed Channel Layout for Input Stream #1.0 : stereo
Input #1, s32be, from 'pipe:0':
  Duration: N/A, bitrate: 2822 kb/s
    Stream #1:0: Audio: pcm_s32be, 44100 Hz, stereo, s32, 2822 kb/s
Output #0, matroska, to 'pipe:1':
  Metadata:
    encoder         : Lavf57.83.100
    Stream #0:0: Video: mjpeg (MJPG / 0x47504A4D), yuvj422p(pc, bt470bg/unknown/unknown), 1280x540 [SAR 1:1 DAR 64:27], q=2-31, 25 tbr, 1k tbn, 1200k tbc
    Stream #0:1: Audio: pcm_s32be ([255][255][255][255] / 0xFFFFFFFF), 44100 Hz, stereo, s32, 2822 kb/s
Stream mapping:
  Stream #0:0 -> #0:0 (copy)
  Stream #1:0 -> #0:1 (copy)

**Comment by mattcampbellsa** [comment]
Launches VLC but nothing happens from there...

**Comment by mattcampbellsa** [comment]
Ideally what the goal here to do is use vlc to transcode into unicast stream

**Comment by mattcampbellsa** [comment]
Morning Ben,
trust you well, had any joy with the above?
Thnx

**Comment by foxy82** [comment]
Not sure if it is the same as the issue here: https://github.com/benjojo/de-ip-hdmi/issues/15 

As I posted there changing to a different source helped for me.
